{
  "wallet_address": "0xabcdef1234567890abcdef1234567890abcdef12",
  "chain": "multi-chain",
  "timestamp": "2024-01-15T10:30:00Z",
  "timeframe": {
    "from": "2023-01-01T00:00:00Z",
    "to": "2024-01-15T10:30:00Z",
    "period": "all-time"
  },
  "win_rate": {
    "overall": 0.68,
    "by_timeframe": {
      "1d": 0.75,
      "7d": 0.71,
      "30d": 0.69,
      "all_time": 0.68
    },
    "profitable_trades": 68,
    "total_trades": 100
  },
  "pnl_summary": {
    "realized_pnl": {
      "total_usd": 187500.0,
      "average_per_trade_usd": 1875.0,
      "best_trade_usd": 45000.0,
      "worst_trade_usd": -8500.0
    },
    "unrealized_pnl": {
      "total_usd": 23400.0,
      "by_token": [
        {
          "token_address": "0xTOKEN1234567890abcdef1234567890abcdef12",
          "token_symbol": "MOON",
          "unrealized_pnl_usd": 15000.0,
          "entry_value_usd": 10000.0,
          "current_value_usd": 25000.0
        },
        {
          "token_address": "0xTOKEN2567890abcdef1234567890abcdef12345",
          "token_symbol": "ROCKET",
          "unrealized_pnl_usd": 8400.0,
          "entry_value_usd": 5000.0,
          "current_value_usd": 13400.0
        }
      ]
    },
    "total_volume": {
      "buy_volume_usd": 425000.0,
      "sell_volume_usd": 612500.0,
      "total_volume_usd": 1037500.0
    }
  },
  "performance_metrics": {
    "average_trade_duration_hours": 48.5,
    "average_profit_per_trade_usd": 1875.0,
    "trade_frequency_per_day": 0.27,
    "sharpe_ratio": 2.35,
    "max_drawdown": -0.15
  },
  "breakdown_by_token": [
    {
      "token_address": "0xTOKEN1234567890abcdef1234567890abcdef12",
      "token_symbol": "MOON",
      "chain": "ethereum",
      "trade_count": 12,
      "win_rate": 0.75,
      "total_pnl_usd": 45000.0,
      "average_roi": 3.2,
      "volume_usd": 120000.0,
      "first_trade": "2023-06-15T10:00:00Z",
      "last_trade": "2024-01-10T14:30:00Z"
    },
    {
      "token_address": "0xTOKEN2567890abcdef1234567890abcdef12345",
      "token_symbol": "ROCKET",
      "chain": "bsc",
      "trade_count": 8,
      "win_rate": 0.625,
      "total_pnl_usd": 28000.0,
      "average_roi": 2.1,
      "volume_usd": 85000.0,
      "first_trade": "2023-08-22T08:15:00Z",
      "last_trade": "2024-01-12T16:45:00Z"
    },
    {
      "token_address": "0xTOKEN3890abcdef1234567890abcdef123456789",
      "token_symbol": "DOGE2",
      "chain": "solana",
      "trade_count": 25,
      "win_rate": 0.64,
      "total_pnl_usd": 52500.0,
      "average_roi": 1.8,
      "volume_usd": 235000.0,
      "first_trade": "2023-03-10T12:00:00Z",
      "last_trade": "2024-01-14T09:20:00Z"
    }
  ],
  "breakdown_by_chain": [
    {
      "chain": "ethereum",
      "trade_count": 35,
      "win_rate": 0.71,
      "total_pnl_usd": 95000.0,
      "volume_usd": 425000.0
    },
    {
      "chain": "bsc",
      "trade_count": 28,
      "win_rate": 0.64,
      "total_pnl_usd": 45000.0,
      "volume_usd": 280000.0
    },
    {
      "chain": "solana",
      "trade_count": 37,
      "win_rate": 0.68,
      "total_pnl_usd": 47500.0,
      "volume_usd": 332500.0
    }
  ],
  "trades": [
    {
      "trade_id": "trade_001",
      "token_address": "0xTOKEN1234567890abcdef1234567890abcdef12",
      "token_symbol": "MOON",
      "chain": "ethereum",
      "entry_timestamp": "2024-01-10T10:00:00Z",
      "exit_timestamp": "2024-01-12T14:30:00Z",
      "entry_price": 1.25e-06,
      "exit_price": 5.62e-06,
      "quantity": "10000000000000000000000",
      "entry_value_usd": 10000.0,
      "exit_value_usd": 45000.0,
      "pnl_usd": 35000.0,
      "roi": 3.5,
      "duration_hours": 52.5,
      "status": "closed"
    },
    {
      "trade_id": "trade_002",
      "token_address": "0xTOKEN2567890abcdef1234567890abcdef12345",
      "token_symbol": "ROCKET",
      "chain": "bsc",
      "entry_timestamp": "2024-01-14T08:00:00Z",
      "exit_timestamp": null,
      "entry_price": 5e-07,
      "exit_price": null,
      "quantity": "10000000000000000000000",
      "entry_value_usd": 5000.0,
      "exit_value_usd": null,
      "pnl_usd": null,
      "roi": null,
      "duration_hours": null,
      "status": "open"
    }
  ],
  "behavioral_patterns": {
    "pattern_tags": [
      "early_adopter",
      "swing_trader",
      "multi_chain",
      "smart_money_follower"
    ],
    "is_bot_like": false,
    "is_smart_money": true,
    "copies_wallet": "0xSMARTWALLET567890abcdef1234567890abcde",
    "wash_trading_score": 0.05
  },
  "related_wallets": [
    {
      "wallet_address": "0xRELATED1234567890abcdef1234567890abcdef",
      "relationship_type": "fund_flow",
      "correlation_score": 0.85,
      "shared_tokens": 12
    },
    {
      "wallet_address": "0xRELATED2567890abcdef1234567890abcdef123",
      "relationship_type": "similar_pattern",
      "correlation_score": 0.72,
      "shared_tokens": 8
    },
    {
      "wallet_address": "0xRELATED3890abcdef1234567890abcdef1234567",
      "relationship_type": "coordinated",
      "correlation_score": 0.68,
      "shared_tokens": 15
    }
  ],
  "ranking": {
    "global_rank": 1247,
    "chain_rank": 523,
    "percentile": 0.95
  }
}